CPU,CPU Power Mode: Cortex-A78,C1 IDLE State (WFI),"The CPU Power Mode: Cortex-A78 subcategory features the C1 IDLE State (WFI), a power-saving state where the CPU enters a low-power mode by freezing all execution and entering a wait-for-interrupt (WFI) state."
CPU,SMP,Symmetric multiprocessing,Symmetric multiprocessing (SMP) refers to a CPU architecture where multiple processing units work together simultaneously to process tasks concurrently and share system resources symmetrically.
CPU,CPU Hotplug,Dynamic CPU Hotplug,"Dynamic CPU Hotplug allows for adding or removing CPUs dynamically at runtime, enabling flexible and efficient resource allocation and utilization in automotive systems that require variable processing power."
Connectivity,N930,Crash Dump,"The Connectivity: N930 - Crash Dump is a diagnostic feature that captures and stores critical system information, such as memory dumps, CPU registers, and kernel stacks, in the event of a system crash or failure to facilitate efficient troubleshooting and debugging."
Connectivity,N931,N930 Bootloader,"The N930 Bootloader refers to a proprietary firmware that initializes and boots the Linux-based system on automotive infotainment devices, allowing for secure loading of software images and configuration settings."
Connectivity,N932,N930 Main Binary,"The ""N930 Main Binary"" is the primary executable file that runs on the vehicle's internal network, enabling communication between various automotive systems and devices."
Connectivity,N930 Interface IPC,Configure Reserved Memory for sharing with N930,"Configure Reserved Memory allows developers to allocate and reserve specific memory regions for use by the N930 interface, enabling efficient data transfer and communication between the Linux system and the N930's internal processing units."
Connectivity,N930 Interface IPC,Control N930 On/Off/Reset,"Control N930 On/Off/Reset: A feature that enables or disables the communication interface between the vehicle's internal controller and external devices through a serial bus protocol, allowing for the transfer of data and commands."
Connectivity,N930 Interface IPC,Device Power Management,"The ""Device Power Management"" term within the Connectivity > N930 Interface IPC subcategory refers to the system's ability to dynamically manage power consumption of connected devices and peripherals to optimize energy efficiency while maintaining performance and reliability."
Connectivity,N930 Interface IPC,Tx/Rx via. PCIe link device,"The transmission (Tx) and reception (Rx) of data via the N930 interface occur through a PCIe link device, facilitating high-speed communication between automotive systems."
Connectivity,PCIe Single SoC,PCIe RC,"The PCIe Root Complex (RC) is a component that enables a Linux-based automotive system to communicate with peripherals and other devices through the Peripheral Component Interconnect Express (PCIe) bus, providing a high-speed interface for data transfer."
Connectivity,PCIe Single SoC,PCIe Bifurcartion(RC),"In the context of PCIe Single SoC connectivity, PCIe bifurcation (RC) is a technology that enables multiple devices to be connected to a single PCIe root complex."
Connectivity,PCIe Single SoC,PCIe EP,"A PCIe EP is an Endpoint device that enables communication with other devices on the PCIe bus, providing a high-speed interface for data transfer in automotive applications."
Connectivity,PCIe Single SoC,PCIe Bifurcartion(EP),"The PCIe bifurcation (EP) is an architectural feature that enables a Peripheral Component Interconnect Express (PCIe) endpoint to be split into multiple downstream devices, allowing for efficient communication and data transfer in automotive systems."
Connectivity,PCIe Mutli SoC,Link training and link up,"Link training and link up: The process by which PCIe Multi-SOC systems establish and optimize communication between multiple System-on-Chip (SoC) devices on a single Peripheral Component Interconnect Express (PCIe) lane, ensuring reliable data transfer and minimizing errors."
Connectivity,PCIe Mutli SoC,Dislink,"The ""Dislink"" feature enables the efficient handling of multiple PCIe interfaces on a Multi-SoC (System-on-Chip) platform by minimizing latency and maximizing bandwidth through intelligent link management and dynamic reconfiguration."
Connectivity,PCIe Mutli SoC,Doorbell,"In the context of PCIe Multi-SOC connectivity, the Doorbell refers to a signaling mechanism used by devices to request attention from other devices on the same bus, facilitating communication and data transfer between them."
Connectivity,PCIe Mutli SoC,MSI/MSI-X,"""Message Signaled Interrupts (MSI) and Message Signaled Interrupts eXtended (MSI-X) are PCIe bus features that enable interrupt signaling between the Peripheral Component Interconnect Express (PCIe) bus and the processor, allowing for more efficient and scalable system designs in automotive applications."""
Connectivity,PCIe Mutli SoC,DMA,"""DMA (Direct Memory Access): In PCIe Multi-SOC connectivity, DMA enables external devices to directly access and manipulate memory without involving the CPU, improving data transfer efficiency and reducing system latency."""
Connectivity,PCIe Mutli SoC,SCD,"""SCD (Single-Chip Controller) refers to a device that integrates multiple peripherals and controllers for automotive connectivity purposes within the PCIe Multi-SOC architecture."""
Connectivity,PCIe Mutli SoC,vEthernet over SCD,"""vEthernet over SCD is a technology that enables virtual Ethernet networking over Scalable Coherent Interface (SCI), allowing multiple System-on-Chip (SoC) devices to communicate efficiently in automotive systems."""
Connectivity,PCIe Switch,TO BE DONE,"A PCIe switch enables connection and routing of multiple peripherals and devices through a single PCIe link, allowing for improved system scalability and flexibility in automotive applications."
Connectivity,USB,Android ADB support,The connectivity/USB/Android ADB Support feature enables developers to remotely debug and access Android-based infotainment systems on Linux-based automotive platforms using the Android Debug Bridge (ADB) protocol.
Connectivity,USB,Linux ADB Support,"Linux ADB (Android Debug Bridge) support enables developers to debug and communicate with Android-based automotive infotainment systems via USB connection, facilitating the development and testing of connected car features."
Connectivity,USB,HUB,"A USB HUB is a device that connects multiple USB devices to a single host computer or controller, increasing the number of available USB ports and enhancing data transfer capabilities."
Connectivity,USB,Input Device (Keyboard Mouse),"The ""Input Device (Keyboard Mouse)"" is a USB-based connectivity feature that enables the integration of keyboard and mouse devices with automotive systems for input and control purposes."
Connectivity,USB,Mass Storage,"The Connectivity/USB/Mass Storage term is defined as: ""A USB feature that enables devices to store and retrieve data on mass storage media, such as flash drives or external hard drives, allowing for the transfer of large amounts of data between devices."""
Connectivity,USB,MTP MEDIA TRANSFER PROTOCOL,"The Media Transfer Protocol (MTP) is a standardized protocol for transferring media files between devices over USB, allowing for the exchange of music, video, and other digital content."
Connectivity,USB,USB Host Device Configuration,"The USB Host Device Configuration refers to the process by which the host system (such as an automotive infotainment unit) determines and configures the type of device connected via a USB port, allowing for communication between the two devices."
Connectivity,USB,xHCI,The xHCI (eXtensible Host Controller Interface) is a high-speed USB controller interface protocol that enables faster data transfer rates and support for new USB devices on Linux-based automotive systems.
Connectivity,Ethernet,Packet/Multi Channel Packet Tx/Rx,"The transmission and reception of multiple Ethernet packets simultaneously using a single interface, allowing for increased bandwidth and reduced latency in automotive systems that require high-speed data exchange."
Connectivity,Ethernet,Link up (ping test loopback),"The process of verifying that an Ethernet connection is operational by sending a ping command to the device's loopback address and receiving a response, indicating a link-up condition."
Connectivity,Ethernet,vEthernet (ping test between VMs),"A virtual Ethernet (vEthernet) is a software-defined network connection that enables pinging tests between virtual machines (VMs) in a Linux-based automotive system, allowing for efficient communication and diagnostic capabilities."
Connectivity,Ethernet,Supported speed/SerDes modes (RGMII/SGMII/USXGMII 1Gbps/2.5Gbps/10Gbps (loopback)),"The ""Supported Speed/SerDes Modes"" refers to the ability of an Ethernet interface to operate at various speeds and SerDes (Serializer-Deserializer) modes, including RGMII, SGMII, USXGMII, 1 Gbps, 2.5 Gbps, and 10 Gbps, with support for loopback functionality."
Connectivity,Ethernet,Ethernet-IOV (HPT),"Ethernet-IOV (HPT) refers to an Ethernet interface's ability to map multiple hardware queues to a single virtual queue, improving packet processing efficiency and reducing latency in high-performance automotive applications."
Connectivity,Ethernet Multi SoC,Link up (ping test),Link Up (Ping Test): The process of verifying connectivity between two Ethernet devices using ping packets to ensure a successful link establishment and data transfer in an Automotive Ethernet network.
Connectivity,Ethernet Multi SoC,Supported speed,"The term ""Supported speed"" under Connectivity > Ethernet Multi SoC refers to the highest data transfer rate that the system can handle over an Ethernet connection, typically measured in Mbps or Gbps."
Connectivity,Ethernet Multi SoC,PTP,"PTP (Precision Time Protocol) is a network protocol used for synchronizing multiple Ethernet nodes in automotive systems, ensuring accurate and reliable communication over the multi-SOC architecture."
Connectivity,Ethernet Multi SoC,HPT,High-Priority Transmission (HPT) refers to a high-speed Ethernet protocol designed for automotive systems that ensures reliable and timely transmission of critical data between multiple System-on-Chip (SoC) devices in a vehicle.
Connectivity,Ethernet Switch,PRP,A PRP (Primitive Real-time Protocol) is a time-sensitive Ethernet switch protocol designed for automotive applications that ensures predictable and low-latency communication between nodes in the vehicle network.
Connectivity,Ethernet Switch,switching speed ( + measuring CPU load ),"The ""switching speed"" refers to the maximum data transfer rate supported by an Ethernet switch, typically measured in Gigabits per second (Gbps), which affects the overall system performance and CPU load when processing network traffic."
Connectivity,Ethernet Switch,PTP TC,"""PTP TC (Precision Time Protocol Timing Controller): A hardware component responsible for generating and transmitting timing information over Ethernet networks in automotive applications to ensure precise synchronization of vehicle systems."""
Connectivity,Ethernet Switch,TO BE DONE ,"""The TO BE DONE term refers to a software-defined networking technology that enables automated configuration and management of Ethernet switches in automotive systems."""
Graphics,Graphics Platform,Vulkan 1.1 (Wayland),"Vulkan 1.1 (Wayland): A graphics API and graphics platform that enables developers to create high-performance, cross-platform graphics applications for automotive systems, utilizing the Wayland protocol as its display interface."
Graphics,Graphics Platform,Vulkan 1.1 (Andorid),"Vulkan 1.1 (Android): A graphics API that provides a low-overhead, cross-platform framework for rendering 2D and 3D graphics on Android devices, allowing for efficient and high-performance graphics processing in automotive systems."
Graphics,Graphics Platform,GPU Information Interface,"The GPU Information Interface is a software component that provides standardized access to Graphics Processing Unit (GPU) characteristics and capabilities, enabling efficient integration with graphics-related systems and applications."
Graphics,Graphics Platform,GPU SysFS User Interface,The GPU SysFS User Interface is a system file interface that provides a standardized and efficient way for applications to access and control Graphics Processing Unit (GPU) settings and performance parameters in Linux-based automotive systems.
Graphics,Graphics Platform,EGL 1.4 STANDARD(Android),"EGL (Embedded Graphics Library) 1.4 Standard is a specification that defines a set of APIs and protocols for rendering graphics on Android-based systems, enabling the development of high-performance, power-efficient graphics applications in automotive infotainment systems."
Graphics,Graphics Platform,EGL 1.4 Standard(Wayland),"The EGL 1.4 Standard (Wayland) refers to an open-standard graphics interface that enables communication between display devices and host systems, providing a platform for rendering and processing graphical data in automotive applications using Linux-based Wayland technology."
Graphics,Graphics Platform,OPENCL 2.0 FULL PROFILE STANDARD,"The Graphics/Platform term ""OPENCL 2.0 FULL PROFILE STANDARD"" is an industry-wide standard for open-source parallel programming that enables developers to leverage heterogeneous processing units, including GPUs and CPUs, to accelerate compute-intensive workloads in automotive systems."
Graphics,Graphics Platform,OPENGL ES 1.1 STANDARD,"The OpenGL ES 1.1 Standard is a widely adopted, low-level graphics API that provides a set of libraries and protocols for rendering two-dimensional and three-dimensional graphics on embedded systems and mobile devices in the automotive industry."
Graphics,Graphics Platform,OPENGL ES 2.0 STANDARD,"The OpenGL ES 2.0 Standard is a widely adopted, vendor-independent API for rendering 2D and 3D graphics on embedded systems, enabling the development of high-performance, power-efficient graphics applications for automotive in-vehicle infotainment systems."
Graphics,Graphics Platform,OPENGL ES 3.0 STANDARD,"The OpenGL ES 3.0 standard is a widely adopted, cross-platform graphics API that enables the development of high-performance, visually rich graphics and multimedia applications for automotive infotainment systems."
Graphics,Graphics Platform,OPENGL ES 3.1 STANDARD,"The OpenGL ES 3.1 standard is an open-source graphics API used for rendering high-performance 2D and 3D graphics on embedded systems, such as automotive infotainment displays, adhering to the latest industry standards."
Graphics,Graphics Platform,OPENGL ES 3.2 STANDARD,"The OpenGL ES 3.2 standard is a widely-used, royalty-free graphics API that provides a set of programming interfaces for developing high-performance, 3D graphics and visual effects in automotive systems."
Graphics,Graphics Platform,GPU Memory Profiling,"GPU Memory Profiling: The process of monitoring and analyzing the memory usage patterns of graphics processing units (GPUs) in real-time, enabling developers to optimize graphics rendering performance by identifying memory-intensive operations and allocating resources more efficiently."
Multimedia,Graphics Platform,Display 10BPC,"The ""Display 10BPC"" refers to a graphics display capability that can render high-resolution images with a pixel density of 10 bits per color component (BPC), providing a more detailed and vibrant visual experience in automotive infotainment systems."
Multimedia,Graphics Platform,DisplayPort,"DisplayPort: A digital video interface standard that allows for high-speed transmission of audio and video signals over a single cable, used in the graphics platform to enable multiple display configurations."
Multimedia,Graphics Platform,H/W Overlay,"The ""H/W Overlay"" refers to a software component that provides a graphical overlay on top of hardware-accelerated graphics processing units (GPUs) to enhance the rendering and display capabilities for automotive in-vehicle information systems."
Multimedia,Graphics Platform,HDP,"The High-Definition Playback (HDP) is a Graphics Platform feature that enables the playback of high-definition images and videos on automotive displays, providing crystal-clear visual experiences for drivers and passengers."
Multimedia,Graphics Platform,libdrm KMS ioctls Support,"The Linux developers' glossary: ""Libdrm KMS ioctls support refers to the integration of the Direct Rendering Manager (DRM) library with the Kernel Mode Setting (KMS) interface, enabling the system's graphics platform to utilize kernel-level functions for efficient and secure management of display resources."""
Multimedia,Graphics Platform,MST,"The Multimedia/ Graphics Platform/MST (Media Streaming Technology) enables efficient transmission and decoding of graphics-rich content across vehicle networks, enhancing the in-car entertainment experience for drivers and passengers."
Multimedia,Graphics Platform,Multiple Display to DP/DSI,"The Multiple Display to DP/DSI feature enables the simultaneous display of multiple graphics surfaces on external monitors via Digital Visual Interface (DVI), DisplayPort (DP), or Display Serial Interface (DSI) connectors, allowing for enhanced in-vehicle infotainment and navigation experiences."
Multimedia,Graphics Platform,DSI,"The Digital Display Interface (DSI) is a graphics interface standard used for high-resolution displays in automotive applications, enabling the transmission of video and image data between devices."
Multimedia,Scaler,Scaling/Cropping/Rotation/Flipping/Color Space Conversion,"The process of scaling/cropping/rotation/flipping/color space conversion enables the efficient manipulation and rendering of multimedia content for automotive systems, such as displaying high-quality images or videos on in-car infotainment screens while minimizing computational resources."
Multimedia,GEM,Graphics Execution Manager,"The Graphics Execution Manager (GEM) is a middleware layer that manages graphics rendering and execution on Linux-based systems for automotive applications, providing a abstraction layer between the operating system and graphics hardware to enable efficient and flexible graphics processing."
Multimedia,UBM,Local Domain Connection,Local Domain Connection: A UBM feature that enables vehicles to establish and maintain a connection with a local domain server for seamless multimedia content delivery and vehicle-to-infrastructure communication.
Multimedia,UBM,Remote Domain Connection,"The Multimedia > UBM > Remote Domain Connection feature allows for secure and reliable wireless connectivity between vehicles and the cloud-based Universal Broadcast Module (UBM) infrastructure, enabling seamless data transfer and synchronization."
Multimedia,HWC HAL,Non-secure Buffer Video Playback Support,"Non-secure Buffer Video Playback Support: The capability to playback video content from non-secure buffers, allowing for the display of multimedia data in vehicle infotainment systems without compromising the security and integrity of the underlying system."
Multimedia,HWC HAL,Secure Buffer Video Playback Support,"""Secure Buffer Video Playback Support: Enables secure playback of video content by validating and verifying the integrity of buffer data within the HWC (Human-Machine Interface) HAL, ensuring safe and trusted multimedia rendering in automotive systems."""
Multimedia,HWC HAL,Source Buffer Client Composition Support,"The Multimedia/HWC HAL/Source Buffer Client Composition Support refers to the capability for the HWC (Head-Up Display) HAL (Hardware Abstraction Layer) to manage and compose multiple source buffers, such as video and audio streams, to create a unified multimedia experience."
Multimedia,HWC HAL,DRM HWC Display,DRM HWC Display: A feature that enables secure and compliant display of high-resolution graphics and video content for in-vehicle infotainment systems on Head-Worn Displays (HWDs) through the integration with a Hardware Abstraction Layer (HAL).
Multimedia,DMA ,DMA Heap,"The Multimedia > DMA > DMA Heap term is: ""A designated memory area used by the Linux-based automotive multimedia system for storing and managing Direct Memory Access (DMA) buffers."""
Multimedia,Audio Interface,I2S/TDM Speaker in Audio Interface,I2S/TDM speaker in the audio interface refers to an integrated circuit that supports both Inter-IC Sound (I2S) and Time-Division Multiplexing (TDM) protocols for transmitting high-quality digital audio signals.
Multimedia,Audio Firmware,DSP in abox fw,A digital signal processor (DSP) is embedded within an audio box firmware to efficiently process and manipulate audio signals for advanced automotive infotainment systems.
Multimedia,Audio Firmware,I2S/TDM Mic in Audio Firmware,"I2S/TDM Mic in Audio Firmware refers to the integration of Inter-IC Sound (I2S) or Time-Division Multiplexing (TDM) interfaces with microphones within the audio firmware, enabling high-quality digital audio data transfer for automotive multimedia applications."
Multimedia,Audio Firmware,I2S/TDM Speaker in Audio Firmware,"I2S/TDM speaker refers to a type of audio interface that uses the Inter-IC Sound (I2S) or Time-Division Multiplexing (TDM) protocol to transmit digital audio signals between devices, supporting high-quality, multi-channel audio playback in automotive systems."
Multimedia,Audio Firmware,Routing,"In the context of audio firmware, routing refers to the configuration settings that dictate how audio signals are processed and directed within a system, enabling efficient and optimized audio processing for automotive applications."
Multimedia,System MMU,System MMU,"The System MMU (Multimedia Middleware Unit) is a software component that manages and optimizes the playback and rendering of multimedia content within the vehicle's infotainment system, providing features such as seamless switching between audio and video sources."
Video,Video,H.264 Decoding,"""H.264 decoding refers to the process by which an automotive system's video processing module efficiently and accurately decompresses and interprets encoded video data using the H.264 (MPEG-4 AVC) compression standard."""
Video,Video,H.264 Encoding,"H.264 Encoding: A video compression standard used to reduce the bitrate and size of video streams, allowing for efficient transmission and storage of high-quality video content in automotive systems."
Video,Video,HEVC Decoding,"""HEVC Decoding: High-Efficiency Video Coding (HEVC) decoding capability for compressing and decompressing video data used in automotive applications."""
Video,Video,HEVC Encoding,"HEVC (High-Efficiency Video Coding) encoding refers to a video compression technology used for efficiently storing and transmitting high-quality video content in automotive applications, such as advanced driver-assistance systems (ADAS)."
Video,Video,Multi-Instance Decoding/Encoding,"""Multi-Instance Decoding/Encoding: A video processing feature that enables simultaneous decoding and encoding of multiple video instances or streams, allowing for efficient handling of complex video workflows in automotive applications."""
Video,Video,VP9 Decoding,"""VP9 Decoding: A video decoding technology that enables the efficient and high-quality playback of video content encoded using the VP9 codec, a royalty-free format for compressing and decompressing digital video."""
Video,Video,VP9 Encoding,"""VP9 Encoding: A video compression algorithm that allows for efficient encoding and decoding of video data, used in the Linux-based system for automotive industry to reduce file size and improve playback performance."""
Video,Video,AV1 Decoding,"AV1 Decoding: A technology that enables the decoding and playback of Advanced Video Coding (AV1) video streams within automotive systems, allowing for efficient and high-quality video rendering."
Video,SMFC,JPEG Decoding/Encoding,"""JPEG Decoding/Encoding: A feature that enables the efficient and accurate processing of compressed images, specifically JPEG format, within a vehicle's infotainment system."""
POWER,ACPM,ACPM Framework,"The ACPM Framework is an automotive-specific power management framework that enables efficient and adaptive control of electrical loads in vehicles, facilitating advanced driver assistance systems (ADAS) and electric vehicle functions."
POWER,BTS,BTS ,"In the POWER > BTS category, BTS stands for Battery Thermal System, which is a feature that regulates the temperature of vehicle batteries to optimize their performance and longevity in various operating conditions."
POWER,CMU,CMU,"""CMU (Central Management Unit): A hardware or software component that manages and controls various systems and functions within the vehicle, including powertrain, chassis, and body control modules."""
POWER,ECT,Exynos Characteristic Table,"The Power > ECT (Electronic Control) category defines the ""Exynos Characteristic Table"" as a proprietary data structure used by the Exynos microcontroller to store and manage the characteristics of automotive systems, enabling advanced control and optimization algorithms."
POWER,PMIC,Power Management Integrated Circuit  driver support,"The Power Management Integrated Circuit (PMIC) driver support enables communication between the vehicle's onboard computer and the PMIC, facilitating power management functions such as voltage regulation and load switching."
POWER,PMIC RTC,Samsung PMIC RTC driver support,"The Samsung PMIC RTC driver support is a feature that enables Linux-based systems for the automotive industry to integrate with Real-Time Clock (RTC) modules from Samsung's Power Management ICs (PMICs), facilitating accurate timekeeping and system synchronization."
