POWER,ACPM DVFS Plugin,ACPM DVFS Plugin,"The ACPM (Adaptive CPU Power Management) DVFS (Dynamic Frequency and Voltage Scaling) Plugin is a software component that dynamically adjusts the processor's frequency and voltage to optimize power consumption, thermal management, and performance in automotive applications."
POWER,DTM,Temperature Measurment,Temperature Measurement: The capability to measure and record temperature data from various sensors within the vehicle's powertrain and other systems for diagnostic purposes and performance optimization.
POWER,DTM,Tripping Control,"The Power/DTM/Tripping Control refers to a system that monitors and controls the battery voltage, ensuring it remains within a safe range while preventing excessive discharge or overcharge events."
POWER,SUSPEND TO RAM,S2R,"When a system is suspended to RAM (S2R), it means that the operating system saves the current state of all running applications and processes in volatile memory, allowing for quick restoration upon resuming from the suspended state."
SECURITY,CRYPTOMANAGER,SSS AES CONTROL,"The Cryptomanager's Secure Socket Service (SSS) AES Control refers to the mechanism for securely encrypting and decrypting data transmitted over sockets using Advanced Encryption Standard (AES) algorithms, ensuring secure communication between automotive systems."
SECURITY,Secure Boot,Android Verified Boot,"""Android Verified Boot (AVB) ensures the authenticity and integrity of automotive software updates by verifying digital signatures and encrypting boot images for secure firmware updates."""
SECURITY,Secure Boot,Secure Boot,Secure Boot: A security mechanism that ensures the authenticity and integrity of firmware components during the boot process by verifying their digital signatures against a trusted key store before allowing system startup.
SECURITY,Secure Boot,Firmware Secure Boot,"A firmware secure boot ensures that the Linux-based system boots with a trusted and validated boot loader, preventing unauthorized code execution at startup by verifying the digital signature of the bootloader against a trusted public key."
SECURITY,OTP,OTP Programming/Reading,One-Time Password (OTP) programming/reading refers to the process of generating and verifying secure authentication codes used for secure login and data access in automotive systems.
SECURITY,Flash Memory Protector,FMP File Based Encryption,"The FMP (Flash Memory Protector) File-Based Encryption feature securely encrypts data stored on flash memory storage devices used in automotive systems, ensuring confidentiality and integrity of sensitive information."
SECURITY,Flash Memory Protector,FMP Metadata Encryption,The FMP Metadata Encryption is a security feature that encrypts metadata stored on flash memory devices to prevent unauthorized access and protect against data theft in automotive systems.
SECURITY,DRAM Encryption, DEE for support DRAM encryption of EL3 monitor,"DEE (Device Enclave Engine) refers to the technology supporting the encryption of Data RAM (DRAM) used in automotive systems' EL3 (Embedded Linux Layer 3) monitors, ensuring secure memory access and confidentiality."
SECURITY,DRAM Encryption, DEE for support DRAM encryption of Secure OS,"""DEE (Dynamic Encryption Engine): A cryptographic engine that provides support for secure memory encryption on Secure OS, ensuring the confidentiality and integrity of data stored in dynamic random-access memory (DRAM)."""
SECURITY,Binary Encryption,Binary Encryption for EL3/LDFW,"Binary encryption for EL3/LDFW refers to the secure encryption process that protects electronic license plates (EL3) and license document front covers (LDFW) by converting data into unreadable binary code, ensuring confidentiality and integrity of sensitive information."
SECURITY,Secure Monitor,EPBL/EL3 Monitor,"The EPBL/EL3 Monitor is a software component that monitors and manages Exceptional Program Behavior Layer (EPBL) and External Level 3 (EL3) exceptions, ensuring secure handling of potential security breaches in automotive systems."
SECURITY,RTIC,Generate Hash Value,"""Generate Hash Value: A security feature that creates a digital fingerprint of electronic control unit (ECU) software and hardware components, allowing for secure authentication and verification of system integrity."""
SECURITY,Secure OS,Secure OS,"A Secure Operating System is a Linux-based OS that implements robust security features and controls to prevent unauthorized access, ensure data confidentiality and integrity, and provide real-time monitoring and reporting of system activities."
SECURITY,DRM,Widevine DRM,"Widevine DRM is a digital rights management (DRM) solution that enables secure playback and content protection for automotive infotainment systems, ensuring copyright compliance and user authentication."
SECURITY,MAC,SELinux,"""SELinux (Security-Enhanced Linux) is a Mandatory Access Control (MAC) system that enforces a strict access control policy on Linux systems to prevent unauthorized access to resources."""
SECURITY,Gatekeeper,Gatekeeper,"The Gatekeeper is a Linux-based security framework that provides an additional layer of access control and authentication for automotive systems, ensuring secure communication and data exchange between various components."
SECURITY,Keymint,Keymint,"""Keymint: A proprietary encryption mechanism developed by the automotive industry consortium, ensuring secure communication between vehicles and the cloud through authenticated key exchange and data encryption."""
SECURITY,RPMB,RPMB,"""RPMB (Role-Based Privilege Management and Binding) refers to a security feature that manages access control and privilege elevation for automotive systems by assigning specific roles and permissions to users or entities."""
STORAGE,UFS,Data read and write,"In the UFS (Universal Flash Storage) category of STORAGE, ""Data read and write"" refers to the ability to efficiently transfer data between a storage device and the host system."
STORAGE,UFS,Device enumeration,"""Device enumeration is a UFS storage feature that allows systems to automatically detect and list connected storage devices, simplifying the process of adding or removing storage media."""
STORAGE,UFS,Device error handling,"""Device Error Handling: Mechanism for detecting and responding to errors that occur on Universal Flash Storage (UFS) devices, ensuring reliable data retrieval and system stability in the automotive industry."""
STORAGE,UFS,Data read and write with HPT,Data read and write with HPT (Hybrid Positioning Technology) enables UFS (Universal Flash Storage) systems to efficiently transfer data between the storage device and the host system while improving overall performance and reliability in automotive applications.
STORAGE,UFS,Device enumeration with HPT,Device enumeration with HPT (Host Port Technology) enables the identification and configuration of Universal Flash Storage (UFS) devices connected to a vehicle's in-vehicle network.
STORAGE,UFS,Device error handling with HPT,"Device error handling with HPT: A mechanism that enables the UFS (Universal Flash Storage) device to detect and recover from errors that occur during data transfer, ensuring reliable storage and retrieval of automotive systems' critical data."
STORAGE,UFS,Gear5 Interface,The Gear5 Interface is a proprietary protocol used by UFS (Universal Flash Storage) systems to manage high-speed data transfers between automotive control units and storage devices.
STORAGE,UFS,PH/VH weight scheduling,"In UFS storage, PH/VH weight scheduling is a technique that adjusts the priority of I/O operations based on the physical (PH) and virtual (VH) block handling weights to optimize storage performance and efficiency."
STORAGE,UFS,Multi Channel Queue with SPI,"""In UFS (Unified File System), Multi-Channel Queue with SPI enables concurrent data transfer across multiple storage channels, improving overall system performance and reducing latency in automotive systems."""
STORAGE,UFS,Multi Channel Queue with ESI,"The STORAGE/UFS/Multi Channel Queue with ESI term is: A high-performance storage feature that enables multiple channels of data transfer in parallel, utilizing Extended Storage Interface (ESI) to optimize the allocation and management of memory-mapped I/O operations."
STORAGE,UFS,Multi Channel Queue with SPI and HPT,The Multi Channel Queue with SPI and HPT is a storage management system that allows for concurrent data transfer across multiple channels using SPI (Serial Peripheral Interface) and HPT (Hierarchical Priority Transfer) mechanisms to optimize UFS (Universal Flash Storage) performance.
STORAGE,UFS,Multi Channel Queue with ESI and HPT,A multi-channel queue with Extended Synchronization Interface (ESI) and Hierarchical Priority Targeting (HPT) is a storage management feature that enables efficient handling of concurrent I/O requests from multiple channels while prioritizing critical operations.
SYSTEM,Mailbox,Mailbox-H,"In the SYSTEM > Mailbox category, ""Mailbox-H"" refers to a high-level mailbox that serves as an abstraction layer for multiple low-level mailboxes, enabling efficient communication between automotive systems."
SYSTEM,DMA,DMA I/F,"The SYSTEM/DMA/DMA I/F: A mechanism that enables communication between the system's memory and external peripherals such as sensors or actuators in the automotive industry, facilitating data transfer and improving overall system performance."
SYSTEM,Debugging,Debug Snapshot,"A system for automotive industry! Here is your glossary entry:

The Debug Snapshot feature allows developers to capture and save a snapshot of the system's current state, including variables, logs, and memory dumps, facilitating debugging and problem resolution in complex automotive systems."
SYSTEM,Debugging,Dump GPR,"""Dump GPR: A system debugging feature that captures the current state of General Purpose Registers (GPRs) in real-time, allowing developers to analyze and troubleshoot issues with register values."""
SYSTEM,Debugging,PC Value extraction through Coresight on Panic,"During debugging, PC (Program Counter) value extraction is enabled through CoreSight technology on panic events, allowing developers to retrieve and analyze the program's instruction pointer at the time of the crash or error occurrence."
SYSTEM,Debugging,ECC Handler,"The SYSTEM Debugging subcategory term ""ECC Handler"" is a software module responsible for detecting and correcting errors in automotive systems' memory that occur due to single-event effects."
SYSTEM,Debugging,ITMON,"""In-Transit Monitoring (ITMON) is a system feature that tracks and analyzes vehicle data during transit, enabling real-time monitoring and debugging of automotive systems."""
SYSTEM,Debugging,Watchdog Timer,"A watchdog timer is a system component that periodically monitors and restarts a Linux-based automotive control unit if it fails to respond or becomes unresponsive, ensuring the continued operation of critical systems."
SYSTEM,Debugging,PPMU,"""Power Power Management Unit (PPMU): A system component that monitors and controls power consumption in automotive systems, enabling developers to optimize energy efficiency and troubleshoot issues."""
SYSTEM,Debugging,RAM DUMP ON PANIC,"A Linux glossary for automotive systems! Here's the glossary entry:

The RAM Dump on Panic feature captures and saves system memory contents in a crash dump file when the system experiences a panic or unexpected shutdown, providing debugging data for post-mortem analysis."
SYSTEM,GPIO,GPIO Control,"The SYSTEM/GPIO/.GPIO Control: A software module responsible for controlling and managing General-Purpose Input/Output (GPIO) pins on automotive devices, allowing for programmable input/output operations."
SYSTEM,GPIO,GPIO Interrupt Function,"The SYSTEM/GPIO/GPIO Interrupt Function: A software function that handles and processes interrupts generated by General Purpose Input/Output (GPIO) pins on an automotive system's microcontroller, enabling the system to respond to external events such as button presses or sensor readings."
SYSTEM,Interrupt Management,Interrupt Management,"""System: Interrupt Management - Mechanism for handling asynchronous events or interrupts that temporarily pause the normal flow of program execution to handle critical system tasks."""
SYSTEM,"LK
(Little Kernel)",A/B Booting,"The SYSTEM/LK (Little Kernel) term ""A/B Booting"" refers to the process of allowing two different operating systems or kernel versions to be bootable from a single device, such as an SD card."
SYSTEM,"LK
(Little Kernel)",PIT for Virtual Machine,"A Linux developer's delight!

Here is the glossary entry:

PIT (Periodic Interrupt Timer) for Virtual Machine: A timer-based interrupt mechanism in LK that generates periodic interrupts to virtual machines, enabling them to schedule and manage their own timing and synchronization requirements."
SYSTEM,"LK
(Little Kernel)",Quick Booting,"The SYSTEM/LK/Quick Booting term is defined as a feature that enables rapid system booting and initialization times by leveraging Little Kernel's capabilities to quickly load essential drivers and services, allowing for faster startup and reduced overall system latency."
SYSTEM,"LK
(Little Kernel)",USB Downloader Support,"The SYSTEM/LK term ""USB Downloader Support"" refers to the capability for the Little Kernel to download and install software updates or firmware patches via a USB connection."
SYSTEM,"LK
(Little Kernel)",USB First Booting,"The SYSTEM/LK/USB First Booting term is defined as: ""A mechanism that enables the Little Kernel (LK) to boot directly from a USB device without requiring an external power supply."""
SYSTEM,"LK
(Little Kernel)",USB Second Booting,The SYSTEM/LK/USB Second Booting term refers to a mechanism that enables a Linux-based system to boot from a USB device after the primary boot process has failed or been interrupted.
SYSTEM,"LK
(Little Kernel)",UFS BOOTING,"""UFS Booting: A process by which the Little Kernel (LK) loads and executes the Unified Filesystem (UFS) to manage file operations and provide a foundation for the automotive system's software architecture."""
SYSTEM,"LK
(Little Kernel)",FASTBOOT COMMAND SUPPORT,"The SYSTEM/LK/Fastboot Command Support term is defined as support for executing fastboot commands from the Linux kernel, enabling rapid and efficient system testing and debugging in automotive applications."
SYSTEM,System Timer,SCHEDULE TIMER FUNCTION,"The Schedule Timer Function is a system timer feature that enables developers to schedule periodic tasks or events at specific intervals, ensuring timely and efficient system operation."
SYSTEM,USI,UART Device Configuration,The SYSTEM/USI/UART Device Configuration refers to the process of defining and configuring serial communication settings for automotive systems' Universal Asynchronous Receiver Transmitter (UART) devices.
SYSTEM,USI,UART DMA,"In SYSTEM > USI, UART DMA refers to a peripheral that enables the transfer of serial data between the system's Universal Asynchronous Receiver-Transmitter (UART) and main memory using Direct Memory Access (DMA)."
SYSTEM,USI,UART Transfer,"""Under System Interface (USI), UART Transfer refers to the process of transmitting data through Universal Asynchronous Receiver-Transmitter ports in automotive systems."""
SYSTEM,USI,SPI Device Configration,"""SPI (Serial Peripheral Interface) device configuration refers to the process of setting up and configuring external devices that utilize the Serial Peripheral Interface protocol to communicate with the vehicle's onboard computer."""
SYSTEM,USI,SPI DMA,The SYSTEM/USI/SPI DMA term refers to a Serial Peripheral Interface (SPI) bus that utilizes Direct Memory Access (DMA) technology to transfer data between the SPI controller and the system memory.
SYSTEM,USI,SPI Transfer,"The SYSTEM/USI/SPI Transfer glossary entry is: ""SPI Transfer refers to the process of sending and receiving data over the Serial Peripheral Interface (SPI) bus protocol, commonly used for communication between automotive control units."""
SYSTEM,USI,HSI2C Device Configuration,The SYSTEM/USI/HSI2C Device Configuration refers to the process of configuring and initializing High-Speed Interface (HSI) 2C devices used in automotive systems for data transfer and communication protocols.
SYSTEM,USI,HSI2C Read/Write,"The SYSTEM/USI term ""HSI2C Read/Write"" refers to the High-Speed Interface (HSI) protocol used for bidirectional data transfer between automotive systems and external devices, such as sensors or actuators, over a 2-wire CAN bus."
SFI BL,SFI BL,Bootloader,"In SFI (Secure Firmware Initiative) BL (Bootloader), the Bootloader is a low-level software component responsible for loading and executing the vehicle's primary operating system from non-volatile storage devices, ensuring secure and reliable boot-up of automotive systems."
SFI CDD,ABOX,ABOX,An Automotive Bus Object eXchange (ABOX) is a software framework that enables seamless communication between various automotive electronic control units and gateways in an automotive network.
SFI CDD,BIC,Bus Integrity Checker,The Bus Integrity Checker (BIC) is a feature that ensures the integrity and validity of data transmitted over the SFI (Serial Peripheral Interface) bus in automotive systems.
SFI CDD,CLKMON,CLKMON,"""CLKMON: A software component responsible for monitoring clock signal quality and stability in automotive systems, ensuring accurate timing and synchronization of vehicle control functions."""
SFI CDD,DPU,DPU,"The Data Processing Unit (DPU) is a hardware component that provides a centralized processing and acceleration solution for automotive applications, allowing for efficient data processing and analysis in real-time."
SFI CDD,EXT_WDG,ExtWdg,"The **ExtWdg** term refers to an External Warning Device that provides visual and auditory alerts to vehicle occupants in the event of a system malfunction or potential hazard, such as a tire pressure warning or a low-fuel indicator."
SFI CDD,FMU,FMU,"A Feature Model Update (FMU) is a software component that enables real-time data exchange and synchronization between multiple systems or modules within an automotive application, facilitating the integration of various sensors, actuators, and control units."
SFI CDD,Mailbox,Mailbox-S,"""A mailbox-S is a software interface that enables the exchange of data between applications running on different systems, facilitating communication and coordination within the automotive industry's systems-of-systems architecture."""
SFI CDD,SFILIB,SFI DRAM Utility,"The ""SFI DRAM Utility"" is a software tool that manages and troubleshoots dynamic random access memory (DRAM) configurations for automotive systems developed with the Scalable Front-end Interface (SFI) technology, enabling efficient debugging and optimization of DRAM usage."
SFI CDD,SFILIB,Safety Access Protection,"A safety-critical feature for the automotive industry! Here's the glossary entry:

Safety Access Protection: A mechanism that ensures secure and authorized access to sensitive data and systems, preventing unauthorized modifications or tampering with vehicle control systems."
SFI CDD,SFILIB,SFILib- SoC variant,"Here is the glossary entry:

The SFILib-SoC variant refers to a specific instance of the System-on-Chip (SoC) hardware platform used in vehicle systems, optimized for use with the Software Framework Interface Library (SFILib)."
SFI CDD,SFILIB,SFILib- SPMI Utility,"Here is the glossary entry:

The SFILib-SPMI Utility is a software tool used for configuring and managing Secure Peripheral Memory Interface (SPMI) devices in automotive systems, enabling secure memory-mapped I/O operations."
SFI CDD,SFILIB,SFILib- Power Utility,"A Linux development team working on automotive systems! Here's the glossary entry:

The SFILib-Power Utility is a software library that provides functions for managing power consumption and energy harvesting in vehicle systems, enabling more efficient use of electrical power within automotive applications."
SFI CDD,SFRMON,Periodic Register Monitor,"A periodic register monitor is a software component that periodically reads and monitors automotive system registers, allowing for real-time monitoring of system parameters and fault detection."
SFI CDD,SFTST,CLKMON POST,"CLKMON POST refers to a hardware test procedure used to verify the timing and synchronization of clock signals in automotive systems, ensuring proper communication between various electronic control units (ECUs) and sensors."
SFI CDD,SFTST,DCLS(Dual-Core Lockstep) POST,"""DCLS (Dual-Core Lockstep) POST refers to the process of verifying and validating the execution of automotive software on dual-core processors, ensuring that both cores run concurrently in a lockstep manner."""
SFI CDD,SFTST,DRAM Safety Mechanism Self-Test,The SFI CDD SFTST DRAM Safety Mechanism Self-Test: A self-test mechanism that verifies the integrity of a Dynamic Random Access Memory (DRAM) module to ensure it operates safely and correctly in an automotive system.
SFI CDD,SFTST,FMU(Fault Management Unit) POST,"The SFI CDD SFTST FMU (Fault Management Unit) POST is a software component responsible for processing and logging fault-related data after a system failure or shutdown, ensuring accurate diagnosis and repair of automotive systems."
SFI CDD,SFTST,INTMEM ECC POST,INTMEM ECC POST: In-Module Error Correction and Checksum Post-processing is a feature that performs error detection and correction on the contents of an automotive control module's internal memory to ensure data integrity.
SFI CDD,SFTST,Safety Access Protection POST,"Safety Access Protection (POST) is a system that provides secure and controlled access to vehicle data, ensuring the integrity of critical safety-related information while preventing unauthorized access or tampering."
SFI CDD,SFTST,VOLMON POST,"""SFTST VOLMON POST: A process that enables the vehicle's powertrain system to generate and store voltage during monopulse testing, allowing for more accurate and efficient testing of electric motor control systems."""
SFI CDD,SFTST,Watchdog Timer POST,A Watchdog Timer POST is a mechanism that periodically restarts the system by performing a Power-On Self-Test (POST) if the watchdog timer detects no activity or response from the system within a specified time interval.
SFI CDD,SFTST,ECC Wrapper POST,"An ECC (Error-Correcting Code) Wrapper is a software component that provides a standardized interface for error correction and detection functionality in the SFI CDD (Sensor Fusion Interface Controller Driver Domain), enabling seamless integration with various automotive sensor types and protocols."
SFI CDD,SFTST,PMIC double-lock POST,"In SFI CDD's SFTST subcategory, PMIC double-lock POST refers to the power management integrated circuit (PMIC) locking itself twice during a Power-On Self-Test (POST) sequence to ensure stable power delivery and prevent system crashes in automotive systems."
SFI CDD,SFTST,SCI POST,"""SCI POST: A type of standardized communication interface that enables secure and reliable data exchange between systems and components in the automotive industry."""
SFI CDD,SFTST,TMU POST,"TMU POST: The Testing Management User interface used for creating and managing test cases, test plans, and test suites in the SFI (Software Framework Interface) environment."
SFI CDD,SFTST,XSPI POST,"The ""XSPI POST"" is a type of software test that verifies the post-processing of Extended Synchronization Protocol Interface (XSPI) data in automotive systems."
SFI CDD,STLM,STLM,"""STLM: Short-Term Load Management, a system that enables real-time load balancing and optimization for efficient processing and prioritization of vehicle-related data."""
SFI CDD,TMU_SFI,TMU in SFI,"""TMU in SFI: Time-to-Minimum-User (TMU) is a key performance indicator that measures the time it takes for an autonomous vehicle to reach its minimum safe following distance from another vehicle or obstacle."""
SFI CDD,USI,USI,"""Unified Serial Interface (USI): A standardized serial communication protocol used for exchanging data between the vehicle's onboard computer and external devices in the automotive industry."""
SFI CDD,VOLMON,VOLMON,"In the SFI CDD VOLMON category, VOLMON refers to a software feature that monitors and manages vehicle operating modes, ensuring optimal power delivery and efficiency across various driving scenarios."
SFI MCAL,DIO,DIO,"In SFI MCAL, DIO refers to Digital Input/Output, which enables the system to interact with external devices by reading and writing digital signals."
SFI MCAL,ETH,ETH,"""ETH: A high-level protocol used for communication between devices on a CAN (Controller Area Network) bus in automotive systems."""
SFI MCAL,FLS,FLS,FLS (Fault Location and Severity): A feature that uses machine learning algorithms to analyze sensor data and determine the location and severity of faults occurring in a vehicle's systems.
SFI MCAL,GPT,GPT,"GPT: Generic Port Timer is a software module that provides timer functionality for General Port (GP) pins on the SoC, allowing developers to schedule and manage port-based interrupts in automotive systems."
SFI MCAL,MCU,MCU,The Microcontroller (MCU) is a small computer chip embedded in the Motor Control Unit (MCU) that executes instructions and controls various functions in the SFI MCAL system.
SFI MCAL,PORT,PORT,"The SFI (Safety Framework Integrated) MCAL (Microcontroller Abstraction Layer) PORT subcategory defines the PORT term as: A software abstraction layer that provides a standardized interface to the microcontroller's I/O ports, allowing developers to access and manipulate pins without direct hardware manipulation."
